{
  "id": "T-20260514-075440",
  "topic": "ticket-schema-json",
  "milestone": "M2: race-condition hardening (atomic bus + schema + non-overlap)",
  "title": "Add schemas/ticket.schema.json + verification harness for ticket payloads",
  "prompt": "Create a JSON Schema (draft 2020-12) describing the autopilot ticket payload, and a self-contained bash test harness that validates fixtures against it.",
  "knowledge_refs": [
    "knowledge/synthesis.md#T5",
    "knowledge/external-obsidian.md#schema-gated-bilingual-output"
  ],
  "scope_paths": [
    "schemas/",
    "tests/ticket-schema/"
  ],
  "acceptance": [
    "test -f schemas/ticket.schema.json && jq -e . schemas/ticket.schema.json >/dev/null",
    "test -x tests/ticket-schema/test.sh && bash tests/ticket-schema/test.sh"
  ],
  "engine_hint": "claude",
  "role": "verification",
  "difficulty": 2,
  "issued_at": "2026-05-14T07:54:40Z",
  "issued_by": "pm",
  "worktree": "../auto-pilot-worker-2"
}
